{
  "eventId": "evt:provisioning-approved-case-plan",
  "eventType": "provisioning.approved",
  "occurredAt": "2026-05-21T17:00:00.000Z",
  "actor": "service:decision-api",
  "subjectId": "user:alice",
  "resourceId": "document:case-plan",
  "correlationId": "corr:case-plan-read",
  "payloadHash": "sha256:aaaaaaaaaaaaaaaaaaaaaaaaaaaaaaaaaaaaaaaaaaaaaaaaaaaaaaaaaaaaaaaa",
  "payload": {
    "planId": "plan:decision:allow-alice-read-case-plan",
    "connectorId": "mock",
    "mode": "enforcement",
    "approval": {
      "decision": "approved",
      "approverId": "user:approver",
      "changeTicket": "chg:phase4-controlled-enforcement",
      "approvedAt": "2026-05-21T17:00:00.000Z"
    },
    "control": {
      "syntheticOnly": true,
      "liveProviderWrites": false,
      "incidentMode": false,
      "breakGlass": false
    }
  }
}
